{
  "target_skill": "dev-graph:run-dev-graph-schedule",
  "args": "--repo-root eval-log/dev-graph/live-trial-fixtures/r8-schedule --max-parallel 4",
  "requested_model": "",
  "actual_model": [
    "claude-opus-5"
  ],
  "nudge_count": 0,
  "gate_response_count": 0,
  "goal_verdict": {
    "result": "PASS",
    "blockers": []
  },
  "overall": {
    "launch": "PASS",
    "completion": "PASS",
    "goal_fit": "PASS",
    "verdict": "PASS"
  },
  "skill_dir_tree_sha": "79bd850a3eadcd14634ae1c0a724fcdb779848e96ca3c552911ce32fe2c0fc3b",
  "transcript_sha256": "8442bc67fb79b1f39fa3a18ba719f570180db409e1bd84455a7c2754c28b5c9c",
  "scenario_origin": "replay",
  "environment": {
    "claude_version": "2.1.233",
    "tmux": true,
    "transcript_layer": "jsonl",
    "permissions_mode": "bypassPermissions"
  },
  "tier": "live",
  "downgrade_reason": null,
  "timeline": {
    "boot_s": null,
    "poll_exit": "DONE",
    "wall_clock_s": 934.0
  },
  "scenario_id": "schedule-positive-ready-set"
}
