{
  "target_skill": "dev-graph:run-dev-graph-node",
  "args": "",
  "requested_model": "",
  "actual_model": [
    "claude-opus-5-5"
  ],
  "nudge_count": 0,
  "gate_response_count": 0,
  "gate_kind": "rescue",
  "goal_verdict": {
    "result": "PASS",
    "blockers": []
  },
  "overall": {
    "launch": "PASS",
    "completion": "PASS",
    "goal_fit": "PASS",
    "verdict": "PASS"
  },
  "skill_dir_tree_sha": "fb1e2b4cf00fab9b99f9c81840e9a1824b8a67b4869f3b93000db1bbb1568fd7",
  "transcript_sha256": "be928d2d4a51c82ccd24036010cb67114f20b20d039bada83975545763e288ed",
  "scenario_origin": "synthetic",
  "environment": {
    "claude_version": "2.1.289",
    "tmux": true,
    "transcript_layer": "jsonl",
    "permissions_mode": "bypassPermissions"
  },
  "tier": "live",
  "downgrade_reason": null,
  "timeline": {
    "boot_s": null,
    "poll_exit": "DONE",
    "wall_clock_s": null
  },
  "scenario_id": "C02-OUT1-positive-mixed-artifacts"
}
