{
  "target_skill": "dev-graph:run-dev-graph-decompose",
  "args": "--repo-root eval-log/dev-graph/live-trial-fixtures/r5-decompose --dry-run",
  "requested_model": "",
  "actual_model": [
    "claude-opus-5"
  ],
  "nudge_count": 0,
  "gate_response_count": 0,
  "goal_verdict": {
    "result": "PASS",
    "blockers": []
  },
  "overall": {
    "launch": "PASS",
    "completion": "PASS",
    "goal_fit": "PASS",
    "verdict": "PASS"
  },
  "skill_dir_tree_sha": "52721c4bff5fc90560481a2d9e7f6769f607ee6bccce2641b6b08d36a2d8c1da",
  "transcript_sha256": "3e7d098539edf8163ffb61e3c0e4e39bbede0424a3d82877146d51c7260b7a88",
  "scenario_origin": "replay",
  "environment": {
    "claude_version": "2.1.227",
    "tmux": true,
    "transcript_layer": "jsonl",
    "permissions_mode": "bypassPermissions"
  },
  "tier": "live",
  "downgrade_reason": null,
  "timeline": {
    "boot_s": null,
    "poll_exit": "DONE",
    "wall_clock_s": 195.0
  },
  "scenario_id": "decompose-macro-positive"
}
