{
  "target_skill": "dev-graph:run-dev-graph-init",
  "args": "--repo-root /private/tmp/claude-501/-Users-dm-dev-dev------HarnessHub/512b21d9-0b24-4985-b1b8-d75bd17d8ecf/scratchpad/wt-guard/eval-log/dev-graph/live-trial-fixtures/gm-init --hook-source plugin",
  "requested_model": "",
  "actual_model": [
    "claude-opus-5"
  ],
  "nudge_count": 0,
  "gate_response_count": 0,
  "gate_kind": "rescue",
  "goal_verdict": {
    "result": "PASS",
    "blockers": []
  },
  "overall": {
    "launch": "PASS",
    "completion": "PASS",
    "goal_fit": "PASS",
    "verdict": "PASS"
  },
  "skill_dir_tree_sha": "38e3a7fd4c2217e510187f1ca0fc11b6a09cd2f9ed423c59e1cc07cfcf107057",
  "transcript_sha256": "e00d0ffe5cb469b5755035db5bf61da19d1f903e18f92ec46f756c6c6e428130",
  "scenario_origin": "replay",
  "environment": {
    "claude_version": "2.1.260",
    "tmux": true,
    "transcript_layer": "jsonl",
    "permissions_mode": "bypassPermissions"
  },
  "tier": "live",
  "downgrade_reason": null,
  "timeline": {
    "boot_s": null,
    "poll_exit": "0",
    "wall_clock_s": null
  },
  "scenario_id": "C01-OUT1-positive-idempotence"
}
