{
  "target_skill": "dev-graph:run-dev-graph-decompose",
  "args": "graph 実値 render (LT-FEATURE-001) の上に、render 結果を前回の render と比べる差分 feature と、その差分を要約して読み手に示す要約 feature を足す。差分 feature は LT-FEATURE-001 に依存し、要約 feature は差分 feature に依存する。共有の architecture は既存の ARCH-LT-001 を使う。新しい node の tracker_binding は beads。 --repo-root /private/tmp/claude-501/-Users-dm-dev-dev------harness/077ff83f-2a4a-43b3-ac23-5a506e015759/scratchpad/wttrial/runs/decompose5/fx --dry-run",
  "requested_model": "claude-opus-5-5",
  "actual_model": [
    "claude-opus-5-5"
  ],
  "nudge_count": 0,
  "gate_response_count": 0,
  "gate_kind": "rescue",
  "goal_verdict": {
    "result": "PASS",
    "blockers": []
  },
  "overall": {
    "launch": "PASS",
    "completion": "PASS",
    "goal_fit": "PASS",
    "verdict": "PASS"
  },
  "skill_dir_tree_sha": "666d9e0c09ab0cb20f8501a6b75302f99906afe1fbcf4f8208fd967f44c5fbb2",
  "transcript_sha256": "9a2ea52c323866ef61c2060414e3755d5e453f41b1b54438c5a7876f95f6a6a9",
  "scenario_origin": "replay",
  "environment": {
    "claude_version": "2.1.296",
    "tmux": true,
    "transcript_layer": "jsonl",
    "permissions_mode": "bypassPermissions"
  },
  "tier": "live",
  "downgrade_reason": null,
  "timeline": {
    "boot_s": 2.0,
    "poll_exit": "DONE",
    "wall_clock_s": 490.0
  },
  "scenario_id": "decompose-macro-promotion-gate-beads-fixture-standard-v3"
}
