{
  "target_skill": "dev-graph:run-dev-graph-init",
  "args": "--repo-root eval-log/dev-graph/live-trial-fixtures/r5-init --hook-source plugin",
  "requested_model": "",
  "actual_model": [
    "claude-opus-5"
  ],
  "nudge_count": 0,
  "gate_response_count": 0,
  "goal_verdict": {
    "result": "PASS",
    "blockers": []
  },
  "overall": {
    "launch": "PASS",
    "completion": "PASS",
    "goal_fit": "PASS",
    "verdict": "PASS"
  },
  "skill_dir_tree_sha": "4d952e553e1a40b8355497267144b02c52186b8018866339b846f829a10a265e",
  "transcript_sha256": "a79696b19cf80b28f5c033cd4e503f8a132db237e7f8369532ac34e5cf985b7a",
  "scenario_origin": "replay",
  "environment": {
    "claude_version": "2.1.233",
    "tmux": true,
    "transcript_layer": "jsonl",
    "permissions_mode": "bypassPermissions"
  },
  "tier": "live",
  "downgrade_reason": null,
  "timeline": {
    "boot_s": null,
    "poll_exit": "DONE",
    "wall_clock_s": 450.0
  },
  "scenario_id": "C01-OUT1-positive-idempotence"
}
