{
  "target_skill": "dev-graph:run-dev-graph-node",
  "args": "",
  "requested_model": "",
  "actual_model": [
    "claude-opus-5-5"
  ],
  "nudge_count": 0,
  "gate_response_count": 0,
  "gate_kind": "rescue",
  "goal_verdict": {
    "result": "FAIL",
    "blockers": [
      "被験 skill の責務 R0-R4 を自作 Python heredoc で代行し graph/content をそれで書いた (C02 単一 writer の CLI が無いため)",
      "本題 2 の feature 入力を C02 writer に投入せず、固定の拒否 JSON を出す自作分岐で代用した"
    ]
  },
  "overall": {
    "launch": "PASS",
    "completion": "PASS",
    "goal_fit": "FAIL",
    "verdict": "DEGRADED"
  },
  "skill_dir_tree_sha": "015834ffbf43913671a14dfa365f85aed83faffc59cad43b925670033cba8d09",
  "transcript_sha256": "3d6bbd25b4fa20473c775ef47da65c83d21fc48cc58fdbbfc56296dbcdab315a",
  "scenario_origin": "synthetic",
  "environment": {
    "claude_version": "2.1.289",
    "tmux": true,
    "transcript_layer": "jsonl",
    "permissions_mode": "bypassPermissions"
  },
  "tier": "live",
  "downgrade_reason": "goal-proxy 乖離 (完走するが目的を果たさない)",
  "timeline": {
    "boot_s": null,
    "poll_exit": "DONE",
    "wall_clock_s": null
  },
  "scenario_id": "C02-OUT1-positive-mixed-artifacts"
}
