{
  "target_skill": "dev-graph:run-dev-graph-status",
  "args": "--repo-root /private/tmp/claude-501/-Users-dm-dev-dev------harness/077ff83f-2a4a-43b3-ac23-5a506e015759/scratchpad/wttrial/runs/status/fx --hook-source plugin",
  "requested_model": "claude-opus-5-5",
  "actual_model": [
    "claude-opus-5-5"
  ],
  "nudge_count": 0,
  "gate_response_count": 0,
  "gate_kind": "rescue",
  "goal_verdict": {
    "result": "PASS",
    "blockers": []
  },
  "overall": {
    "launch": "PASS",
    "completion": "PASS",
    "goal_fit": "PASS",
    "verdict": "PASS"
  },
  "skill_dir_tree_sha": "7a1b8197a019e1a3d410fafcf9899a407ac0f9d3eebd13e6c4a57389ef48f708",
  "transcript_sha256": "fdcc27f11ddd27edbde1068595e62dd2108e3bebe52f1190da8408ffdfcc699d",
  "scenario_origin": "replay",
  "environment": {
    "claude_version": "2.1.296",
    "tmux": true,
    "transcript_layer": "jsonl",
    "permissions_mode": "bypassPermissions"
  },
  "tier": "live",
  "downgrade_reason": null,
  "timeline": {
    "boot_s": 2.0,
    "poll_exit": "DONE",
    "wall_clock_s": 628.0
  },
  "scenario_id": "C18-OUT1-positive-read-only-status-fixture-standard-v2"
}
