{
  "target_skill": "dev-graph:run-dev-graph-node",
  "args": "add --repo-root eval-log/dev-graph/live-trial-fixtures/r5-node --input eval-log/dev-graph/live-trial-fixtures/r5-node/mixed-artifacts.json",
  "requested_model": "",
  "actual_model": [
    "claude-opus-5"
  ],
  "nudge_count": 0,
  "gate_response_count": 0,
  "goal_verdict": {
    "result": "PASS",
    "blockers": []
  },
  "overall": {
    "launch": "PASS",
    "completion": "PASS",
    "goal_fit": "PASS",
    "verdict": "PASS"
  },
  "skill_dir_tree_sha": "4b32261086a8c7ed2a983d83b287ea54bab49942a43dd1aa2fc783dad5096d89",
  "transcript_sha256": "880c81eeb7788fba635c4cbbcbd52531705f0b553a797c5f4297c8cb2d3bdffe",
  "scenario_origin": "replay",
  "environment": {
    "claude_version": "2.1.233",
    "tmux": true,
    "transcript_layer": "jsonl",
    "permissions_mode": "bypassPermissions"
  },
  "tier": "live",
  "downgrade_reason": null,
  "timeline": {
    "boot_s": null,
    "poll_exit": "DONE",
    "wall_clock_s": 945.0
  },
  "scenario_id": "C02-OUT1-positive-mixed-artifacts"
}
