{
  "target_skill": "dev-graph:run-dev-graph-node",
  "args": "--repo-root /private/tmp/claude-501/-Users-dm-dev-dev------harness/077ff83f-2a4a-43b3-ac23-5a506e015759/scratchpad/wttrial/runs/node2/fx --hook-source plugin",
  "requested_model": "claude-opus-5-5",
  "actual_model": [
    "claude-opus-5-5"
  ],
  "nudge_count": 0,
  "gate_response_count": 0,
  "gate_kind": "rescue",
  "goal_verdict": {
    "result": "PASS",
    "blockers": []
  },
  "overall": {
    "launch": "PASS",
    "completion": "PASS",
    "goal_fit": "PASS",
    "verdict": "PASS"
  },
  "skill_dir_tree_sha": "929c34ba560554300f47c674c3e9086dc6c9ea130c7630af59e465eff425bc4b",
  "transcript_sha256": "3bed21b2252f277bfae16cb0c39170b87ca280d44efa4227ff6c9106130b3c59",
  "scenario_origin": "replay",
  "environment": {
    "claude_version": "2.1.296",
    "tmux": true,
    "transcript_layer": "jsonl",
    "permissions_mode": "bypassPermissions"
  },
  "tier": "live",
  "downgrade_reason": null,
  "timeline": {
    "boot_s": 2.0,
    "poll_exit": "DONE",
    "wall_clock_s": 341.0
  },
  "scenario_id": "C02-OUT1-positive-mixed-artifacts-fixture-standard-v2"
}
